{"$id":"urn:stage13:triage-input:v2","$schema":"https://json-schema.org/draft/2020-12/schema","additionalProperties":false,"properties":{"EvidenceRefs":{"items":{"additionalProperties":false,"properties":{"digest":{"pattern":"^[0-9a-f]{64}$","type":"string"},"evidence_id":{"maxLength":128,"minLength":1,"pattern":"^[A-Za-z0-9][A-Za-z0-9_.:/@-]*$","type":"string"},"type":{"enum":["CI_SUMMARY","FAILURE_DETAIL","ERROR_EXCERPT","ENVIRONMENT_METADATA","VERSION_METADATA","CHANGE_METADATA","HISTORICAL_KNOWN_FAILURE","AUTHORIZED_ARTIFACT"]}},"required":["evidence_id","digest","type"],"type":"object"},"maxItems":32,"type":"array","uniqueItems":true},"business_context":{"$defs":{"entity_ref":{"additionalProperties":false,"properties":{"id":{"maxLength":128,"minLength":1,"pattern":"^[A-Za-z0-9][A-Za-z0-9_.:/@-]*$","type":"string"},"kind":{"enum":["COMPONENT","ARTIFACT","TEST_LOGIC","OPERATION","RESOURCE","CONFIGURATION","CHANGE","INTERVENTION"]}},"required":["kind","id"],"type":"object"},"evidence_ref":{"additionalProperties":false,"properties":{"digest":{"pattern":"^[0-9a-f]{64}$","type":"string"},"evidence_id":{"maxLength":128,"minLength":1,"pattern":"^[A-Za-z0-9][A-Za-z0-9_.:/@-]*$","type":"string"},"type":{"enum":["CI_SUMMARY","FAILURE_DETAIL","ERROR_EXCERPT","ENVIRONMENT_METADATA","VERSION_METADATA","CHANGE_METADATA","HISTORICAL_KNOWN_FAILURE","AUTHORIZED_ARTIFACT"]}},"required":["evidence_id","digest","type"],"type":"object"},"relation":{"additionalProperties":false,"allOf":[{"else":{"not":{"required":["ownership_mode"]}},"if":{"properties":{"relation_type":{"const":"OWNS"}}},"then":{"properties":{"object":{"properties":{"kind":{"enum":["ARTIFACT","TEST_LOGIC","OPERATION","RESOURCE","CONFIGURATION"]}}},"subject":{"properties":{"kind":{"const":"COMPONENT"}}}},"required":["ownership_mode"]}},{"if":{"properties":{"relation_type":{"const":"PRODUCES_FOR"}}},"then":{"properties":{"object":{"properties":{"kind":{"const":"OPERATION"}}},"subject":{"properties":{"kind":{"enum":["ARTIFACT","OPERATION"]}}}}}},{"if":{"properties":{"relation_type":{"const":"CALLS"}}},"then":{"properties":{"object":{"properties":{"kind":{"const":"OPERATION"}}},"subject":{"properties":{"kind":{"const":"OPERATION"}}}}}},{"if":{"properties":{"relation_type":{"const":"DEPENDS_ON"}}},"then":{"properties":{"object":{"properties":{"kind":{"enum":["OPERATION","RESOURCE","CONFIGURATION"]}}},"subject":{"properties":{"kind":{"const":"OPERATION"}}}}}},{"if":{"properties":{"relation_type":{"const":"TARGETS"}}},"then":{"properties":{"object":{"properties":{"kind":{"enum":["ARTIFACT","TEST_LOGIC","OPERATION","RESOURCE","CONFIGURATION"]}}},"subject":{"properties":{"kind":{"enum":["CHANGE","INTERVENTION"]}}}}}}],"properties":{"object":{"additionalProperties":false,"properties":{"id":{"maxLength":128,"minLength":1,"pattern":"^[A-Za-z0-9][A-Za-z0-9_.:/@-]*$","type":"string"},"kind":{"enum":["COMPONENT","ARTIFACT","TEST_LOGIC","OPERATION","RESOURCE","CONFIGURATION","CHANGE","INTERVENTION"]}},"required":["kind","id"],"type":"object"},"ownership_mode":{"enum":["EXCLUSIVE","EQUIVALENT"]},"relation_id":{"maxLength":128,"minLength":1,"pattern":"^[A-Za-z0-9][A-Za-z0-9_.:/@-]*$","type":"string"},"relation_type":{"enum":["OWNS","PRODUCES_FOR","CALLS","DEPENDS_ON","TARGETS"]},"source_evidence_ref":{"additionalProperties":false,"properties":{"digest":{"pattern":"^[0-9a-f]{64}$","type":"string"},"evidence_id":{"maxLength":128,"minLength":1,"pattern":"^[A-Za-z0-9][A-Za-z0-9_.:/@-]*$","type":"string"},"type":{"enum":["CI_SUMMARY","FAILURE_DETAIL","ERROR_EXCERPT","ENVIRONMENT_METADATA","VERSION_METADATA","CHANGE_METADATA","HISTORICAL_KNOWN_FAILURE","AUTHORIZED_ARTIFACT"]}},"required":["evidence_id","digest","type"],"type":"object"},"source_pointer":{"maxLength":1024,"pattern":"^/","type":"string"},"subject":{"additionalProperties":false,"properties":{"id":{"maxLength":128,"minLength":1,"pattern":"^[A-Za-z0-9][A-Za-z0-9_.:/@-]*$","type":"string"},"kind":{"enum":["COMPONENT","ARTIFACT","TEST_LOGIC","OPERATION","RESOURCE","CONFIGURATION","CHANGE","INTERVENTION"]}},"required":["kind","id"],"type":"object"}},"required":["relation_id","relation_type","subject","object","source_evidence_ref","source_pointer"],"type":"object"}},"$id":"urn:stage13:business-relations:v1","$schema":"https://json-schema.org/draft/2020-12/schema","additionalProperties":false,"properties":{"entities":{"items":{"additionalProperties":false,"properties":{"id":{"maxLength":128,"minLength":1,"pattern":"^[A-Za-z0-9][A-Za-z0-9_.:/@-]*$","type":"string"},"kind":{"enum":["COMPONENT","ARTIFACT","TEST_LOGIC","OPERATION","RESOURCE","CONFIGURATION","CHANGE","INTERVENTION"]}},"required":["kind","id"],"type":"object"},"type":"array","uniqueItems":true},"relations":{"items":{"additionalProperties":false,"allOf":[{"else":{"not":{"required":["ownership_mode"]}},"if":{"properties":{"relation_type":{"const":"OWNS"}}},"then":{"properties":{"object":{"properties":{"kind":{"enum":["ARTIFACT","TEST_LOGIC","OPERATION","RESOURCE","CONFIGURATION"]}}},"subject":{"properties":{"kind":{"const":"COMPONENT"}}}},"required":["ownership_mode"]}},{"if":{"properties":{"relation_type":{"const":"PRODUCES_FOR"}}},"then":{"properties":{"object":{"properties":{"kind":{"const":"OPERATION"}}},"subject":{"properties":{"kind":{"enum":["ARTIFACT","OPERATION"]}}}}}},{"if":{"properties":{"relation_type":{"const":"CALLS"}}},"then":{"properties":{"object":{"properties":{"kind":{"const":"OPERATION"}}},"subject":{"properties":{"kind":{"const":"OPERATION"}}}}}},{"if":{"properties":{"relation_type":{"const":"DEPENDS_ON"}}},"then":{"properties":{"object":{"properties":{"kind":{"enum":["OPERATION","RESOURCE","CONFIGURATION"]}}},"subject":{"properties":{"kind":{"const":"OPERATION"}}}}}},{"if":{"properties":{"relation_type":{"const":"TARGETS"}}},"then":{"properties":{"object":{"properties":{"kind":{"enum":["ARTIFACT","TEST_LOGIC","OPERATION","RESOURCE","CONFIGURATION"]}}},"subject":{"properties":{"kind":{"enum":["CHANGE","INTERVENTION"]}}}}}}],"properties":{"object":{"additionalProperties":false,"properties":{"id":{"maxLength":128,"minLength":1,"pattern":"^[A-Za-z0-9][A-Za-z0-9_.:/@-]*$","type":"string"},"kind":{"enum":["COMPONENT","ARTIFACT","TEST_LOGIC","OPERATION","RESOURCE","CONFIGURATION","CHANGE","INTERVENTION"]}},"required":["kind","id"],"type":"object"},"ownership_mode":{"enum":["EXCLUSIVE","EQUIVALENT"]},"relation_id":{"maxLength":128,"minLength":1,"pattern":"^[A-Za-z0-9][A-Za-z0-9_.:/@-]*$","type":"string"},"relation_type":{"enum":["OWNS","PRODUCES_FOR","CALLS","DEPENDS_ON","TARGETS"]},"source_evidence_ref":{"additionalProperties":false,"properties":{"digest":{"pattern":"^[0-9a-f]{64}$","type":"string"},"evidence_id":{"maxLength":128,"minLength":1,"pattern":"^[A-Za-z0-9][A-Za-z0-9_.:/@-]*$","type":"string"},"type":{"enum":["CI_SUMMARY","FAILURE_DETAIL","ERROR_EXCERPT","ENVIRONMENT_METADATA","VERSION_METADATA","CHANGE_METADATA","HISTORICAL_KNOWN_FAILURE","AUTHORIZED_ARTIFACT"]}},"required":["evidence_id","digest","type"],"type":"object"},"source_pointer":{"maxLength":1024,"pattern":"^/","type":"string"},"subject":{"additionalProperties":false,"properties":{"id":{"maxLength":128,"minLength":1,"pattern":"^[A-Za-z0-9][A-Za-z0-9_.:/@-]*$","type":"string"},"kind":{"enum":["COMPONENT","ARTIFACT","TEST_LOGIC","OPERATION","RESOURCE","CONFIGURATION","CHANGE","INTERVENTION"]}},"required":["kind","id"],"type":"object"}},"required":["relation_id","relation_type","subject","object","source_evidence_ref","source_pointer"],"type":"object"},"type":"array","uniqueItems":true},"schema_version":{"const":"stage13.business-relations.v1"},"snapshot_ref":{"additionalProperties":false,"properties":{"digest":{"pattern":"^[0-9a-f]{64}$","type":"string"},"revision":{"maxLength":128,"minLength":1,"pattern":"^[A-Za-z0-9][A-Za-z0-9_.:/@-]*$","type":"string"},"source_id":{"maxLength":128,"minLength":1,"pattern":"^[A-Za-z0-9][A-Za-z0-9_.:/@-]*$","type":"string"}},"required":["source_id","revision","digest"],"type":"object"}},"required":["schema_version","snapshot_ref","entities","relations"],"type":"object"},"environment_samples":{"items":{"additionalProperties":false,"properties":{"channel_group":{"maxLength":128,"minLength":1,"pattern":"^[A-Za-z0-9][A-Za-z0-9_.:/@-]*$","type":"string"},"environment_id":{"maxLength":128,"minLength":1,"pattern":"^[A-Za-z0-9][A-Za-z0-9_.:/@-]*$","type":"string"}},"required":["environment_id","channel_group"],"type":"object"},"maxItems":8,"type":"array"},"evidence_policy":{"additionalProperties":false,"properties":{"allowed_types":{"items":{"enum":["CI_SUMMARY","FAILURE_DETAIL","ERROR_EXCERPT","ENVIRONMENT_METADATA","VERSION_METADATA","CHANGE_METADATA","HISTORICAL_KNOWN_FAILURE","AUTHORIZED_ARTIFACT"]},"type":"array","uniqueItems":true},"deadline_at":{"type":"string"},"job_deadline_seconds":{"const":180},"max_artifact_reads":{"maximum":4,"minimum":0,"type":"integer"},"max_bytes":{"maximum":1048576,"minimum":0,"type":"integer"},"max_tool_reads":{"maximum":8,"minimum":0,"type":"integer"}},"required":["allowed_types","max_tool_reads","max_artifact_reads","max_bytes","job_deadline_seconds"],"type":"object"},"failure_summary":{"properties":{"component_scope":{"items":{"maxLength":128,"minLength":1,"pattern":"^[A-Za-z0-9][A-Za-z0-9_.:/@-]*$","type":"string"},"type":"array","uniqueItems":true}},"required":["component_scope"],"type":"object"},"incident_ref":{"additionalProperties":false,"properties":{"evidence_revision":{"minimum":1,"type":"integer"},"incident_id":{"maxLength":128,"minLength":1,"pattern":"^[A-Za-z0-9][A-Za-z0-9_.:/@-]*$","type":"string"},"manifest_digest":{"pattern":"^[0-9a-f]{64}$","type":"string"}},"required":["incident_id","evidence_revision","manifest_digest"],"type":"object"},"responsibility_semantics":{"additionalProperties":false,"properties":{"definition":{"const":"对消除该根因所必须修改的代码、配置、数据资产、测试逻辑或基础设施资源具有维护责任的 component。"},"role":{"const":"REMEDIATION_OWNER"},"version":{"const":"stage13.root-responsibility.v2"}},"required":["version","role","definition"],"type":"object"},"schema_version":{"const":"stage13.triage-input.v2"},"scope":{"additionalProperties":false,"properties":{"automation_project_id":{"maxLength":128,"minLength":1,"pattern":"^[A-Za-z0-9][A-Za-z0-9_.:/@-]*$","type":"string"},"business_date":{"pattern":"^[0-9]{4}-[0-9]{2}-[0-9]{2}$","type":"string"},"suite_id":{"maxLength":128,"minLength":1,"pattern":"^[A-Za-z0-9][A-Za-z0-9_.:/@-]*$","type":"string"}},"required":["automation_project_id","suite_id","business_date"],"type":"object"},"version_samples":{"items":{"maxLength":128,"minLength":1,"pattern":"^[A-Za-z0-9][A-Za-z0-9_.:/@-]*$","type":"string"},"type":"array"},"visible_change_inventory":{"items":{"maxLength":128,"minLength":1,"pattern":"^[A-Za-z0-9][A-Za-z0-9_.:/@-]*$","type":"string"},"type":"array","uniqueItems":true},"visible_evidence":{"items":{"required":["evidence_id","type","digest","availability"],"type":"object"},"maxItems":32,"type":"array"}},"required":["schema_version","incident_ref","scope","environment_samples","version_samples","failure_summary","visible_evidence","visible_change_inventory","evidence_policy","responsibility_semantics","business_context"],"type":"object"}