{"business_context":{"entities":[{"id":"fixture-helper","kind":"ARTIFACT"},{"id":"fixture-change","kind":"CHANGE"},{"id":"component-a","kind":"COMPONENT"},{"id":"component-b","kind":"COMPONENT"},{"id":"fixture-config","kind":"CONFIGURATION"},{"id":"fixture-build","kind":"OPERATION"},{"id":"fixture-test","kind":"OPERATION"},{"id":"fixture-service","kind":"RESOURCE"}],"relations":[{"object":{"id":"fixture-test","kind":"OPERATION"},"relation_id":"calls","relation_type":"CALLS","source_evidence_ref":{"digest":"b9586c44aaa14f755917fd4806c33643e3b040049c4e1a88a3bcbbc40b7d4999","evidence_id":"world:test-only-contract","type":"AUTHORIZED_ARTIFACT"},"source_pointer":"/relations/0","subject":{"id":"fixture-build","kind":"OPERATION"}},{"object":{"id":"fixture-service","kind":"RESOURCE"},"relation_id":"depends","relation_type":"DEPENDS_ON","source_evidence_ref":{"digest":"b9586c44aaa14f755917fd4806c33643e3b040049c4e1a88a3bcbbc40b7d4999","evidence_id":"world:test-only-contract","type":"AUTHORIZED_ARTIFACT"},"source_pointer":"/relations/1","subject":{"id":"fixture-test","kind":"OPERATION"}},{"object":{"id":"fixture-helper","kind":"ARTIFACT"},"ownership_mode":"EXCLUSIVE","relation_id":"owns-helper","relation_type":"OWNS","source_evidence_ref":{"digest":"b9586c44aaa14f755917fd4806c33643e3b040049c4e1a88a3bcbbc40b7d4999","evidence_id":"world:test-only-contract","type":"AUTHORIZED_ARTIFACT"},"source_pointer":"/relations/2","subject":{"id":"component-a","kind":"COMPONENT"}},{"object":{"id":"fixture-config","kind":"CONFIGURATION"},"ownership_mode":"EXCLUSIVE","relation_id":"owns-config","relation_type":"OWNS","source_evidence_ref":{"digest":"b9586c44aaa14f755917fd4806c33643e3b040049c4e1a88a3bcbbc40b7d4999","evidence_id":"world:test-only-contract","type":"AUTHORIZED_ARTIFACT"},"source_pointer":"/relations/3","subject":{"id":"component-b","kind":"COMPONENT"}},{"object":{"id":"fixture-test","kind":"OPERATION"},"relation_id":"produces","relation_type":"PRODUCES_FOR","source_evidence_ref":{"digest":"b9586c44aaa14f755917fd4806c33643e3b040049c4e1a88a3bcbbc40b7d4999","evidence_id":"world:test-only-contract","type":"AUTHORIZED_ARTIFACT"},"source_pointer":"/relations/4","subject":{"id":"fixture-helper","kind":"ARTIFACT"}},{"object":{"id":"fixture-helper","kind":"ARTIFACT"},"relation_id":"targets","relation_type":"TARGETS","source_evidence_ref":{"digest":"b9586c44aaa14f755917fd4806c33643e3b040049c4e1a88a3bcbbc40b7d4999","evidence_id":"world:test-only-contract","type":"AUTHORIZED_ARTIFACT"},"source_pointer":"/relations/5","subject":{"id":"fixture-change","kind":"CHANGE"}}],"schema_version":"stage13.business-relations.v1","snapshot_ref":{"digest":"b9586c44aaa14f755917fd4806c33643e3b040049c4e1a88a3bcbbc40b7d4999","revision":"fixture-v1","source_id":"test-only-contract"}},"environment_samples":[{"channel_group":"contract-validation","environment_id":"controlled-context"}],"evidence_policy":{"allowed_types":["AUTHORIZED_ARTIFACT"],"job_deadline_seconds":180,"max_artifact_reads":4,"max_bytes":1048576,"max_tool_reads":8},"failure_summary":{"component_scope":["component-a","component-b"],"observations":[]},"incident_ref":{"evidence_revision":1,"incident_id":"incident:test-only-contract","manifest_digest":"c3837dc4bbfa369fbe27ec72fd8ec1180a109e2a739d03a83bf1fd882ad67d1f"},"responsibility_semantics":{"definition":"对消除该根因所必须修改的代码、配置、数据资产、测试逻辑或基础设施资源具有维护责任的 component。","role":"REMEDIATION_OWNER","version":"stage13.root-responsibility.v2"},"schema_version":"stage13.triage-input.v2","scope":{"automation_project_id":"test-contract","business_date":"2026-10-08","suite_id":"test-contract"},"version_samples":["fixture-v1"],"visible_change_inventory":["fixture-change"],"visible_evidence":[{"availability":"AVAILABLE","content":{"entities":[{"id":"fixture-helper","kind":"ARTIFACT"},{"id":"fixture-change","kind":"CHANGE"},{"id":"component-a","kind":"COMPONENT"},{"id":"component-b","kind":"COMPONENT"},{"id":"fixture-config","kind":"CONFIGURATION"},{"id":"fixture-build","kind":"OPERATION"},{"id":"fixture-test","kind":"OPERATION"},{"id":"fixture-service","kind":"RESOURCE"}],"relations":[{"object":{"id":"fixture-test","kind":"OPERATION"},"relation_id":"calls","relation_type":"CALLS","subject":{"id":"fixture-build","kind":"OPERATION"}},{"object":{"id":"fixture-service","kind":"RESOURCE"},"relation_id":"depends","relation_type":"DEPENDS_ON","subject":{"id":"fixture-test","kind":"OPERATION"}},{"object":{"id":"fixture-helper","kind":"ARTIFACT"},"ownership_mode":"EXCLUSIVE","relation_id":"owns-helper","relation_type":"OWNS","subject":{"id":"component-a","kind":"COMPONENT"}},{"object":{"id":"fixture-config","kind":"CONFIGURATION"},"ownership_mode":"EXCLUSIVE","relation_id":"owns-config","relation_type":"OWNS","subject":{"id":"component-b","kind":"COMPONENT"}},{"object":{"id":"fixture-test","kind":"OPERATION"},"relation_id":"produces","relation_type":"PRODUCES_FOR","subject":{"id":"fixture-helper","kind":"ARTIFACT"}},{"object":{"id":"fixture-helper","kind":"ARTIFACT"},"relation_id":"targets","relation_type":"TARGETS","subject":{"id":"fixture-change","kind":"CHANGE"}}],"revision":"fixture-v1","schema_version":"stage13.business-world.v1","scope":{"automation_project_id":"test-contract","business_date":"2026-10-08","suite_id":"test-contract"},"source_id":"test-only-contract"},"digest":"b9586c44aaa14f755917fd4806c33643e3b040049c4e1a88a3bcbbc40b7d4999","evidence_id":"world:test-only-contract","type":"AUTHORIZED_ARTIFACT"}]}